,positive_prob,negative_prob,neutral_prob,text
1,0.00004,0.99979,0.00017,"Job gains have been robust in recent months, and the unemployment rate has remained low"
2,0.00536,0.00190,0.99274,"Inflation remains elevated, reflecting supply and demand imbalances related to the pandemic, higher food and energy prices, and broader price pressures"
3,0.00001,0,0.99998,Russia's war against Ukraine is causing tremendous human and economic hardship
4,0.04389,0.00015,0.95596,The war and related events are contributing to upward pressure on inflation and are weighing on global economic activity
5,0.98342,0.00051,0.01607,The Committee is highly attentive to inflation risks
